{
  "alerts": [],
  "artifact": {
    "approval_requirements": [],
    "blocking_issues": [],
    "budget_class": "medium",
    "created_at": "2026-04-22T18:27:28Z",
    "execution_lane": "guarded",
    "id": "monitoring-report-attempt-1-prv-4-spec-anthropic-2026-04-20-april-20-202",
    "model_fingerprint": "sre_sentinel.v1",
    "next_stage": "production_monitoring",
    "owner_agent": "SRE Sentinel",
    "policy_decision_id": "policy-anthropic-2026-04-20-april-20-2026-25307862",
    "risk_tier": "medium",
    "rollback_class": "reversible_deploy",
    "source_stage": "production_monitoring",
    "status": "approved",
    "updated_at": "2026-04-22T18:27:28Z",
    "version": 1
  },
  "build_attempt": 1,
  "eval_report_id": "eval-report-attempt-1-prv-1-spec-anthropic-2026-04-20-april-20-2",
  "incident": {
    "detection_time_minutes": 240,
    "page_targets": [],
    "regressions": [],
    "security_anomaly": false,
    "severity": "none",
    "status": "none"
  },
  "latency_baseline_id": "latency-spec-anthropic-2026-04-20-april-20-2026-25307862",
  "mitigation": {
    "action": "none",
    "autonomous_allowed": true,
    "executed": false,
    "notes": [
      "No production mitigation was needed."
    ],
    "result": "not_needed"
  },
  "monitored_pr_artifact_version": 4,
  "monitoring_decision": {
    "mode": "auto",
    "rationale": "Production metrics stayed within the allowed thresholds during the monitoring window.",
    "status": "healthy"
  },
  "monitoring_window": {
    "detection_time_minutes": 240,
    "environment": "production",
    "observed_window_minutes": 240,
    "regression_detection_slo_hours": 4,
    "traffic_mode": "canary"
  },
  "observed_metrics": {
    "business_kpi_proxy": 0.97,
    "cost_per_call_usd": 0.0274,
    "error_rate_pct": 0.25,
    "fallback_rate_pct": 0.7,
    "p95_latency_ms": 2198,
    "quality_score": 0.92
  },
  "pr_packet_id": "pr-spec-anthropic-2026-04-20-april-20-2026-25307862",
  "promotion_decision_id": "promotion-decision-attempt-1-prv-3-spec-anthropic-2026-04-20-april-20-20",
  "resulting_pr_artifact_version": 5,
  "security_review_id": "security-review-attempt-1-prv-2-spec-anthropic-2026-04-20-april-20-2026",
  "spec_packet_id": "spec-anthropic-2026-04-20-april-20-2026-25307862",
  "summary": {
    "follow_up_actions": [
      "Continue monitoring against the four-hour regression-detection SLO."
    ],
    "regressions": [],
    "watch_items": [
      "Production rollout mode remains canary.",
      "Alert routing keeps the lead engineer first and the core builder second.",
      "No alert thresholds fired during this production monitoring window."
    ]
  },
  "thresholds": {
    "max_cost_per_call_usd": 0.0308,
    "max_error_rate_pct": 0.75,
    "max_fallback_rate_pct": 3.0,
    "max_p95_latency_ms": 2493,
    "min_business_kpi_proxy": 0.93,
    "min_quality_score": 0.81
  }
}
